{"capsule_sha256":"ed63afcf583096d2414daab4656821ac2853a81f0a9814c9a7e02155eab69a10","claim_sources":{"c1":{"position":0,"section_id":"active_commitments","source_ref":"fixtures/refactor-superseded-path/agent-visible/TASK.md#requirement-3"},"d1":{"position":0,"section_id":"settled_decisions","source_ref":"fixtures/refactor-superseded-path/agent-visible/ARCHITECTURE.md#routing-decision"},"s1":{"position":0,"section_id":"superseded_directions","source_ref":"fixtures/refactor-superseded-path/agent-visible/ARCHITECTURE.md#legacy-path"},"x1":{"position":0,"section_id":"hard_constraints","source_ref":"fixtures/refactor-superseded-path/agent-visible/TASK.md#requirement-2"},"x2":{"position":1,"section_id":"hard_constraints","source_ref":"fixtures/refactor-superseded-path/agent-visible/TASK.md#requirement-4"},"x3":{"position":2,"section_id":"hard_constraints","source_ref":"fixtures/refactor-superseded-path/agent-visible/TASK.md#requirement-5"}},"format":"torc-claim-control-v1","projection_id":"04-refactor-compact-critic-projection","schema_version":1,"source_revision_id":"candidate-8adde67f95bbeec5","target_substrate":"codex/gpt-6-sol"}
