{"capsule_sha256":"393c5da5a21642dc2a64bb2907a6428b01c141422c0a9cdc093535d3d8c3484c","claim_sources":{"c1":{"position":0,"section_id":"active_commitments","source_ref":"fixtures/design-cutover-plan/agent-visible/TASK.md#hard-constraints-c6"},"c2":{"position":1,"section_id":"active_commitments","source_ref":"fixtures/design-cutover-plan/agent-visible/TASK.md#hard-constraints-c7"},"w1":{"position":0,"section_id":"unresolved_work","source_ref":"cross-agent-collaboration-001#critic-assignment"},"x1":{"position":0,"section_id":"hard_constraints","source_ref":"fixtures/design-cutover-plan/agent-visible/TASK.md#hard-constraints-c1"},"x2":{"position":1,"section_id":"hard_constraints","source_ref":"fixtures/design-cutover-plan/agent-visible/TASK.md#hard-constraints-c2-c5"},"x3":{"position":2,"section_id":"hard_constraints","source_ref":"fixtures/design-cutover-plan/agent-visible/TASK.md#hard-constraints-c3"},"x4":{"position":3,"section_id":"hard_constraints","source_ref":"fixtures/design-cutover-plan/agent-visible/TASK.md#hard-constraints-c4"}},"format":"torc-claim-control-v1","projection_id":"22-design-cutover-codex-artifact-review-compact-critic-projection","schema_version":1,"source_revision_id":"candidate-a91174d8bf1299ea","target_substrate":"codex/gpt-6-sol"}
