{"capsule_sha256":"7aba1a08d64c4bf856956e30ae9e73d5395128e3b5dabd406578625dbe871c7e","claim_sources":{"c1":{"position":0,"section_id":"active_commitments","source_ref":"fixtures/bug-hidden-regression/agent-visible/TASK.md#return-contract"},"c2":{"position":1,"section_id":"active_commitments","source_ref":"fixtures/bug-hidden-regression/agent-visible/TASK.md#compatibility"},"w1":{"position":0,"section_id":"unresolved_work","source_ref":"cross-agent-collaboration-001#critic-assignment"},"x1":{"position":0,"section_id":"hard_constraints","source_ref":"fixtures/bug-hidden-regression/agent-visible/TASK.md#comparison"},"x2":{"position":1,"section_id":"hard_constraints","source_ref":"fixtures/bug-hidden-regression/agent-visible/TASK.md#requirement-1"},"x3":{"position":2,"section_id":"hard_constraints","source_ref":"fixtures/bug-hidden-regression/agent-visible/TASK.md#requirement-2"},"x4":{"position":3,"section_id":"hard_constraints","source_ref":"fixtures/bug-hidden-regression/agent-visible/TASK.md#requirement-5"}},"format":"torc-claim-control-v1","projection_id":"14-bug-codex-artifact-review-critic-projection","schema_version":1,"source_revision_id":"candidate-fcd30fc16e7a3792","target_substrate":"codex/gpt-6-sol"}
