{"capsule_sha256":"6707b9241a3045f4b18f66783d9028e168a50238fcd4f7f8563f860a3be15932","claim_sources":{"c1":{"position":0,"section_id":"active_commitments","source_ref":"fixtures/release-policy-interaction/agent-visible/TASK.md#requirement-7"},"c2":{"position":1,"section_id":"active_commitments","source_ref":"fixtures/release-policy-interaction/agent-visible/TASK.md#requirement-7"},"w1":{"position":0,"section_id":"unresolved_work","source_ref":"cross-agent-collaboration-001#critic-assignment"},"x1":{"position":0,"section_id":"hard_constraints","source_ref":"fixtures/release-policy-interaction/agent-visible/TASK.md#requirement-1"},"x2":{"position":1,"section_id":"hard_constraints","source_ref":"fixtures/release-policy-interaction/agent-visible/TASK.md#requirement-2"},"x3":{"position":2,"section_id":"hard_constraints","source_ref":"fixtures/release-policy-interaction/agent-visible/TASK.md#requirement-3"},"x4":{"position":3,"section_id":"hard_constraints","source_ref":"fixtures/release-policy-interaction/agent-visible/TASK.md#requirement-5"},"x5":{"position":4,"section_id":"hard_constraints","source_ref":"fixtures/release-policy-interaction/agent-visible/TASK.md#requirement-6"}},"format":"torc-claim-control-v1","projection_id":"12-release-full-critic-projection","schema_version":1,"source_revision_id":"candidate-93213ff481c8b41b","target_substrate":"codex/gpt-6-sol"}
