{"capsule_sha256":"ef94640779f86d29fd2d0fa46ef99f26bff62a76d2ddeb048db4d5cacdda243d","claim_sources":{"c1":{"position":0,"section_id":"active_commitments","source_ref":"fixtures/refactor-superseded-path/agent-visible/TASK.md#requirement-3"},"d1":{"position":0,"section_id":"settled_decisions","source_ref":"fixtures/refactor-superseded-path/agent-visible/ARCHITECTURE.md#routing-decision"},"s1":{"position":0,"section_id":"superseded_directions","source_ref":"fixtures/refactor-superseded-path/agent-visible/ARCHITECTURE.md#legacy-path"},"x1":{"position":0,"section_id":"hard_constraints","source_ref":"fixtures/refactor-superseded-path/agent-visible/TASK.md#requirement-2"},"x2":{"position":1,"section_id":"hard_constraints","source_ref":"fixtures/refactor-superseded-path/agent-visible/TASK.md#requirement-4"},"x3":{"position":2,"section_id":"hard_constraints","source_ref":"fixtures/refactor-superseded-path/agent-visible/TASK.md#requirement-5"}},"format":"torc-claim-control-v1","projection_id":"15-refactor-codex-artifact-review-conditional-critic-projection","schema_version":1,"source_revision_id":"candidate-70cbd2e2a91b998d","target_substrate":"codex/gpt-6-sol"}
